paper_id,title,authors,year,citation_count,abstract,url,venue,keyword
5560b6f57a7ee0657a313122193ee2a3527dcaac,Poison-RAG: Adversarial Data Poisoning Attacks on Retrieval-Augmented Generation in Recommender Systems,"Fatemeh Nazary, Yashar Deldjoo, T. D. Noia",2025,34,"This study presents Poison-RAG, a framework for adversarial data poisoning attacks targeting retrieval-augmented generation (RAG)-based recommender systems. Poison-RAG manipulates item metadata, such as tags and descriptions, to influence recommendation outcomes. Using item metadata generated through a large language model (LLM) and embeddings derived via the OpenAI API, we explore the impact of adversarial poisoning attacks on provider-side, where attacks are designed to promote long-tail items and demote popular ones. Two attack strategies are proposed: local modifications, which personalize tags for each item using BERT embeddings, and global modifications, applying uniform tags across the dataset. Experiments conducted on the MovieLens dataset in a black-box setting reveal that local strategies improve manipulation effectiveness by up to 50\%, while global strategies risk boosting already popular items. Results indicate that popular items are more susceptible to attacks, whereas long-tail items are harder to manipulate. Approximately 70\% of items lack tags, presenting a cold-start challenge; data augmentation and synthesis are proposed as potential defense mechanisms to enhance RAG-based systems' resilience. The findings emphasize the need for robust metadata management to safeguard recommendation frameworks. Code and data are available at https://github.com/atenanaz/Poison-RAG.",https://www.semanticscholar.org/paper/5560b6f57a7ee0657a313122193ee2a3527dcaac,European Conference on Information Retrieval,retrieval augmented generation
79e57387a664a5d7b128b2790a8f38f827e09124,Retrieval Augmented Generation Evaluation in the Era of Large Language Models: A Comprehensive Survey,"Aoran Gan, Hao Yu, Kai Zhang, Qi Liu, Wenyu Yan, Zhenya Huang, Shiwei Tong, Guoping Hu",2025,32,"Recent advancements in Retrieval-Augmented Generation (RAG) have revolutionized natural language processing by integrating Large Language Models (LLMs) with external information retrieval, enabling accurate, up-to-date, and verifiable text generation across diverse applications. However, evaluating RAG systems presents unique challenges due to their hybrid architecture that combines retrieval and generation components, as well as their dependence on dynamic knowledge sources in the LLM era. In response, this paper provides a comprehensive survey of RAG evaluation methods and frameworks, systematically reviewing traditional and emerging evaluation approaches, for system performance, factual accuracy, safety, and computational efficiency in the LLM era. We also compile and categorize the RAG-specific datasets and evaluation frameworks, conducting a meta-analysis of evaluation practices in high-impact RAG research. To the best of our knowledge, this work represents the most comprehensive survey for RAG evaluation, bridging traditional and LLM-driven methods, and serves as a critical resource for advancing RAG development.",https://www.semanticscholar.org/paper/79e57387a664a5d7b128b2790a8f38f827e09124,arXiv.org,retrieval augmented generation
5e5c2b08231678dcb33b1f00bc2dd5bb7045bcd5,Improving Retrieval-Augmented Generation through Multi-Agent Reinforcement Learning,"Yiqun Chen, Ling Yan, Weiwei Sun, Xinyu Ma, Yi Zhang, Shuaiqiang Wang, Dawei Yin, Yiming Yang, Jiaxin Mao",2025,33,"Retrieval-augmented generation (RAG) is widely utilized to incorporate external knowledge into large language models, thereby enhancing factuality and reducing hallucinations in question-answering (QA) tasks. A standard RAG pipeline consists of several components, such as query rewriting, document retrieval, document filtering, and answer generation. However, these components are typically optimized separately through supervised fine-tuning, which can lead to misalignments between the objectives of individual components and the overarching aim of generating accurate answers. Although recent efforts have explored using reinforcement learning (RL) to optimize specific RAG components, these approaches often focus on simple pipelines with only two components or do not adequately address the complex interdependencies and collaborative interactions among the modules. To overcome these limitations, we propose treating the complex RAG pipeline with multiple components as a multi-agent cooperative task, in which each component can be regarded as an RL agent. Specifically, we present MMOA-RAG, Multi-Module joint Optimization Algorithm for RAG, which employs multi-agent reinforcement learning to harmonize all agents'goals toward a unified reward, such as the F1 score of the final answer. Experiments conducted on various QA benchmarks demonstrate that MMOA-RAG effectively boost the overall performance of the pipeline and outperforms existing baselines. Furthermore, comprehensive ablation studies validate the contributions of individual components and demonstrate MMOA-RAG can be adapted to different RAG pipelines and benchmarks.",https://www.semanticscholar.org/paper/5e5c2b08231678dcb33b1f00bc2dd5bb7045bcd5,arXiv.org,retrieval augmented generation
2aa5f446ed125f17f0fe08827fa7a13f07ef482b,"A Systematic Review of Key Retrieval-Augmented Generation (RAG) Systems: Progress, Gaps, and Future Directions","Agada Joseph Oche, Ademola Glory Folashade, Tirthankar Ghosal, Arpan Biswas",2025,37,"Retrieval-Augmented Generation (RAG) represents a major advancement in natural language processing (NLP), combining large language models (LLMs) with information retrieval systems to enhance factual grounding, accuracy, and contextual relevance. This paper presents a comprehensive systematic review of RAG, tracing its evolution from early developments in open domain question answering to recent state-of-the-art implementations across diverse applications. The review begins by outlining the motivations behind RAG, particularly its ability to mitigate hallucinations and outdated knowledge in parametric models. Core technical components-retrieval mechanisms, sequence-to-sequence generation models, and fusion strategies are examined in detail. A year-by-year analysis highlights key milestones and research trends, providing insight into RAG's rapid growth. The paper further explores the deployment of RAG in enterprise systems, addressing practical challenges related to retrieval of proprietary data, security, and scalability. A comparative evaluation of RAG implementations is conducted, benchmarking performance on retrieval accuracy, generation fluency, latency, and computational efficiency. Persistent challenges such as retrieval quality, privacy concerns, and integration overhead are critically assessed. Finally, the review highlights emerging solutions, including hybrid retrieval approaches, privacy-preserving techniques, optimized fusion strategies, and agentic RAG architectures. These innovations point toward a future of more reliable, efficient, and context-aware knowledge-intensive NLP systems.",https://www.semanticscholar.org/paper/2aa5f446ed125f17f0fe08827fa7a13f07ef482b,arXiv.org,retrieval augmented generation
d9052dd87959e6076baf35e8f7ee87d568a32b58,VisRAG: Vision-based Retrieval-augmented Generation on Multi-modality Documents,"Shi Yu, Chaoyue Tang, Bokai Xu, Junbo Cui, J. Ran, Yukun Yan, Zhenghao Liu, Shuo Wang, Xu Han, Zhiyuan Liu, Maosong Sun",2024,168,"Retrieval-augmented generation (RAG) is an effective technique that enables large language models (LLMs) to utilize external knowledge sources for generation. However, current RAG systems are solely based on text, rendering it impossible to utilize vision information like layout and images that play crucial roles in real-world multi-modality documents. In this paper, we introduce VisRAG, which tackles this issue by establishing a vision-language model (VLM)-based RAG pipeline. In this pipeline, instead of first parsing the document to obtain text, the document is directly embedded using a VLM as an image and then retrieved to enhance the generation of a VLM. Compared to traditional text-based RAG, VisRAG maximizes the retention and utilization of the data information in the original documents, eliminating the information loss introduced during the parsing process. We collect both open-source and synthetic data to train the retriever in VisRAG and explore a variety of generation methods. Experiments demonstrate that VisRAG outperforms traditional RAG in both the retrieval and generation stages, achieving a 20--40% end-to-end performance gain over traditional text-based RAG pipeline. Further analysis reveals that VisRAG is efficient in utilizing training data and demonstrates strong generalization capability, positioning it as a promising solution for RAG on multi-modality documents. Our code and data are available at https://github.com/openbmb/visrag.",https://www.semanticscholar.org/paper/d9052dd87959e6076baf35e8f7ee87d568a32b58,International Conference on Learning Representations,retrieval augmented generation
746b96ee17e329f1085a047116c05e12eaa3925a,RQ-RAG: Learning to Refine Queries for Retrieval Augmented Generation,"Chi-Min Chan, Chunpu Xu, Ruibin Yuan, Hongyin Luo, Wei Xue, Yi-Ting Guo, Jie Fu",2024,175,"Large Language Models (LLMs) exhibit remarkable capabilities but are prone to generating inaccurate or hallucinatory responses. This limitation stems from their reliance on vast pretraining datasets, making them susceptible to errors in unseen scenarios. To tackle these challenges, Retrieval-Augmented Generation (RAG) addresses this by incorporating external, relevant documents into the response generation process, thus leveraging non-parametric knowledge alongside LLMs' in-context learning abilities. However, existing RAG implementations primarily focus on initial input for context retrieval, overlooking the nuances of ambiguous or complex queries that necessitate further clarification or decomposition for accurate responses. To this end, we propose learning to Refine Query for Retrieval Augmented Generation (RQ-RAG) in this paper, endeavoring to enhance the model by equipping it with capabilities for explicit rewriting, decomposition, and disambiguation. Our experimental results indicate that our method, when applied to a 7B Llama2 model, surpasses the previous state-of-the-art (SOTA) by an average of 1.9\% across three single-hop QA datasets, and also demonstrates enhanced performance in handling complex, multi-hop QA datasets. Our code is available at https://github.com/chanchimin/RQ-RAG.",https://www.semanticscholar.org/paper/746b96ee17e329f1085a047116c05e12eaa3925a,arXiv.org,retrieval augmented generation
7bd78700829c69a480895346a8d916cf4e93f435,Parametric Retrieval Augmented Generation,"Weihang Su, Yichen Tang, Qingyao Ai, Junxi Yan, Changyue Wang, Hongning Wang, Ziyi Ye, Yujia Zhou, Yiqun Liu",2025,29,"Retrieval-augmented generation (RAG) has emerged as a promising solution to enhance the reliability of large language models (LLMs) with external knowledge. Existing RAG methods share a common strategy for knowledge injection: they place the retrieved documents into the input context of the LLM, which we refer to as the in-context knowledge injection method. While this approach is simple and often effective, it has inherent limitations. Firstly, increasing the context length and number of relevant documents can lead to higher computational overhead and degraded performance, especially in complex reasoning tasks. More importantly, in-context knowledge injection operates primarily at the input level, but LLMs store their internal knowledge in their parameters. This gap fundamentally limits the capacity of in-context methods. To this end, we introduce Parametric RAG, a new RAG paradigm that integrates external knowledge directly into the feed-forward networks of an LLM through document parameterization. This approach not only reduces online computational costs by shortening the input context length, but also deepens the integration of external knowledge by enabling LLMs to utilize it in the same way as internal parametric knowledge. Experimental results demonstrate that Parametric RAG substantially enhances the effectiveness and efficiency of knowledge augmentation in LLMs. Also, it can be combined with in-context RAG methods to achieve even better performance. We have open-sourced all the code, data, and models in the following GitHub link: https://github.com/oneal2000/PRAG",https://www.semanticscholar.org/paper/7bd78700829c69a480895346a8d916cf4e93f435,Annual International ACM SIGIR Conference on Research and Development in Information Retrieval,retrieval augmented generation
554bf1ba2e93599309e56d914509ec26f239301c,Spatial-RAG: Spatial Retrieval Augmented Generation for Real-World Spatial Reasoning Questions,"Dazhou Yu, Riyang Bao, Gengchen Mai, Liang Zhao",2025,30,,https://www.semanticscholar.org/paper/554bf1ba2e93599309e56d914509ec26f239301c,arXiv.org,retrieval augmented generation
320b86d8a23da014d018db23a5f43b94368dd749,Machine Against the RAG: Jamming Retrieval-Augmented Generation with Blocker Documents,"Avital Shafran, R. Schuster, Vitaly Shmatikov",2024,76,"Retrieval-augmented generation (RAG) systems respond to queries by retrieving relevant documents from a knowledge database and applying an LLM to the retrieved documents. We demonstrate that RAG systems that operate on databases with untrusted content are vulnerable to denial-of-service attacks we call jamming. An adversary can add a single ``blocker'' document to the database that will be retrieved in response to a specific query and result in the RAG system not answering this query, ostensibly because it lacks relevant information or because the answer is unsafe. We describe and measure the efficacy of several methods for generating blocker documents, including a new method based on black-box optimization. Our method (1) does not rely on instruction injection, (2) does not require the adversary to know the embedding or LLM used by the target RAG system, and (3) does not employ an auxiliary LLM. We evaluate jamming attacks on several embeddings and LLMs and demonstrate that the existing safety metrics for LLMs do not capture their vulnerability to jamming. We then discuss defenses against blocker documents.",https://www.semanticscholar.org/paper/320b86d8a23da014d018db23a5f43b94368dd749,USENIX Security Symposium,retrieval augmented generation
5bbc2b5aa6c63c6a2cfccf095d6020b063ad47ac,Corrective Retrieval Augmented Generation,"Shi-Qi Yan, Jia-Chen Gu, Yun Zhu, Zhen-Hua Ling",2024,186,"Large language models (LLMs) inevitably exhibit hallucinations since the accuracy of generated texts cannot be secured solely by the parametric knowledge they encapsulate. Although retrieval-augmented generation (RAG) is a practicable complement to LLMs, it relies heavily on the relevance of retrieved documents, raising concerns about how the model behaves if retrieval goes wrong. To this end, we propose the Corrective Retrieval Augmented Generation (CRAG) to improve the robustness of generation. Specifically, a lightweight retrieval evaluator is designed to assess the overall quality of retrieved documents for a query, returning a confidence degree based on which different knowledge retrieval actions can be triggered. Since retrieval from static and limited corpora can only return sub-optimal documents, large-scale web searches are utilized as an extension for augmenting the retrieval results. Besides, a decompose-then-recompose algorithm is designed for retrieved documents to selectively focus on key information and filter out irrelevant information in them. CRAG is plug-and-play and can be seamlessly coupled with various RAG-based approaches. Experiments on four datasets covering short- and long-form generation tasks show that CRAG can significantly improve the performance of RAG-based approaches.",https://www.semanticscholar.org/paper/5bbc2b5aa6c63c6a2cfccf095d6020b063ad47ac,arXiv.org,retrieval augmented generation
b5d553aa0fc8e53c060014d399b2a2cde052dcf4,GFM-RAG: Graph Foundation Model for Retrieval Augmented Generation,"Linhao Luo, Zicheng Zhao, Gholamreza Haffari, D.Q. Phung, Chen Gong, Shirui Pan",2025,26,"Retrieval-augmented generation (RAG) has proven effective in integrating knowledge into large language models (LLMs). However, conventional RAGs struggle to capture complex relationships between pieces of knowledge, limiting their performance in intricate reasoning that requires integrating knowledge from multiple sources. Recently, graph-enhanced retrieval augmented generation (GraphRAG) builds graph structure to explicitly model these relationships, enabling more effective and efficient retrievers. Nevertheless, its performance is still hindered by the noise and incompleteness within the graph structure. To address this, we introduce GFM-RAG, a novel graph foundation model (GFM) for retrieval augmented generation. GFM-RAG is powered by an innovative graph neural network that reasons over graph structure to capture complex query-knowledge relationships. The GFM with 8M parameters undergoes a two-stage training process on large-scale datasets, comprising 60 knowledge graphs with over 14M triples and 700k documents. This results in impressive performance and generalizability for GFM-RAG, making it the first graph foundation model applicable to unseen datasets for retrieval without any fine-tuning required. Extensive experiments on three multi-hop QA datasets and seven domain-specific RAG datasets demonstrate that GFM-RAG achieves state-of-the-art performance while maintaining efficiency and alignment with neural scaling laws, highlighting its potential for further improvement.",https://www.semanticscholar.org/paper/b5d553aa0fc8e53c060014d399b2a2cde052dcf4,arXiv.org,retrieval augmented generation
ff12832394e9c5091234ce9eb8303b53baa53e6a,Retrieval-augmented generation for educational application: A systematic survey,"Zongxi Li, Zijian Wang, Weiming Wang, Kevin Hung, Haoran Xie, F. Wang",2025,74,,https://www.semanticscholar.org/paper/ff12832394e9c5091234ce9eb8303b53baa53e6a,,retrieval augmented generation
9042e7927165a355b28caf15708db1d06625678e,MiniRAG: Towards Extremely Simple Retrieval-Augmented Generation,"Tianyu Fan, Jingyuan Wang, Xubin Ren, Chao Huang",2025,21,"The growing demand for efficient and lightweight Retrieval-Augmented Generation (RAG) systems has highlighted significant challenges when deploying Small Language Models (SLMs) in existing RAG frameworks. Current approaches face severe performance degradation due to SLMs' limited semantic understanding and text processing capabilities, creating barriers for widespread adoption in resource-constrained scenarios. To address these fundamental limitations, we present MiniRAG, a novel RAG system designed for extreme simplicity and efficiency. MiniRAG introduces two key technical innovations: (1) a semantic-aware heterogeneous graph indexing mechanism that combines text chunks and named entities in a unified structure, reducing reliance on complex semantic understanding, and (2) a lightweight topology-enhanced retrieval approach that leverages graph structures for efficient knowledge discovery without requiring advanced language capabilities. Our extensive experiments demonstrate that MiniRAG achieves comparable performance to LLM-based methods even when using SLMs while requiring only 25\% of the storage space. Additionally, we contribute a comprehensive benchmark dataset for evaluating lightweight RAG systems under realistic on-device scenarios with complex queries. We fully open-source our implementation and datasets at: https://github.com/HKUDS/MiniRAG.",https://www.semanticscholar.org/paper/9042e7927165a355b28caf15708db1d06625678e,arXiv.org,retrieval augmented generation
5b2c131b09c27457bbe307e4a39d25e5ed4c8e15,Retrieval-augmented generation elevates local LLM quality in radiology contrast media consultation,"A. Wada, Yuya Tanaka, Mitsuo Nishizawa, Akira Yamamoto, T. Akashi, A. Hagiwara, Yayoi Hayakawa, J. Kikuta, K. Shimoji, Katsuhiro Sano, K. Kamagata, A. Nakanishi, S. Aoki",2025,24,"Large language models (LLMs) demonstrate significant potential in healthcare applications, but clinical deployment is limited by privacy concerns and insufficient medical domain training. This study investigated whether retrieval-augmented generation (RAG) can improve locally deployable LLM for radiology contrast media consultation. In 100 synthetic iodinated contrast media consultations we compared Llama 3.2-11B (baseline and RAG) with three cloud-based models—GPT-4o mini, Gemini 2.0 Flash and Claude 3.5 Haiku. A blinded radiologist ranked the five replies per case, and three LLM-based judges scored accuracy, safety, structure, tone, applicability and latency. Under controlled conditions, RAG eliminated hallucinations (0% vs 8%; χ²₍Yates₎ = 6.38, p = 0.012) and improved mean rank by 1.3 (Z = –4.82, p < 0.001), though performance gaps with cloud models persist. The RAG-enhanced model remained faster (2.6 s vs 4.9–7.3 s) while the LLM-based judges preferred it over GPT-4o mini, though the radiologist ranked GPT-4o mini higher. RAG thus provides meaningful improvements for local clinical LLMs while maintaining the privacy benefits of on-premise deployment.",https://www.semanticscholar.org/paper/5b2c131b09c27457bbe307e4a39d25e5ed4c8e15,,retrieval augmented generation
c67a16f1b60bdd5c0c3fdc201e1d88721cb86ba1,MA-RAG: Multi-Agent Retrieval-Augmented Generation via Collaborative Chain-of-Thought Reasoning,"Thang Nguyen, Peter Chin, Yu-Wing Tai",2025,24,"We present MA-RAG, a Multi-Agent framework for Retrieval-Augmented Generation (RAG) that addresses the inherent ambiguities and reasoning challenges in complex information-seeking tasks. Unlike conventional RAG methods that rely on end-to-end fine-tuning or isolated component enhancements, MA-RAG orchestrates a collaborative set of specialized AI agents: Planner, Step Definer, Extractor, and QA Agents, each responsible for a distinct stage of the RAG pipeline. By decomposing tasks into subtasks such as query disambiguation, evidence extraction, and answer synthesis, and enabling agents to communicate intermediate reasoning via chain-of-thought prompting, MA-RAG progressively refines retrieval and synthesis while maintaining modular interpretability. Extensive experiments on multi-hop and ambiguous QA benchmarks, including NQ, HotpotQA, 2WikimQA, and TriviaQA, demonstrate that MA-RAG significantly outperforms standalone LLMs and existing RAG methods across all model scales. Notably, even a small LLaMA3-8B model equipped with MA-RAG surpasses larger standalone LLMs, while larger variants (LLaMA3-70B and GPT-4o-mini) set new state-of-the-art results on challenging multi-hop datasets. Ablation studies reveal that both the planner and extractor agents are critical for multi-hop reasoning, and that high-capacity models are especially important for the QA agent to synthesize answers effectively. Beyond general-domain QA, MA-RAG generalizes to specialized domains such as medical QA, achieving competitive performance against domain-specific models without any domain-specific fine-tuning. Our results highlight the effectiveness of collaborative, modular reasoning in retrieval-augmented systems: MA-RAG not only improves answer accuracy and robustness but also provides interpretable intermediate reasoning steps, establishing a new paradigm for efficient and reliable multi-agent RAG.",https://www.semanticscholar.org/paper/c67a16f1b60bdd5c0c3fdc201e1d88721cb86ba1,arXiv.org,retrieval augmented generation
72047a3141cffe6c4564258212c5d648cad1e36f,Practical Poisoning Attacks against Retrieval-Augmented Generation,"Baolei Zhang, Yuxi Chen, Minghong Fang, Zhuqing Liu, Lihai Nie, Tong Li, Zheli Liu",2025,22,"Large language models (LLMs) have demonstrated impressive natural language processing abilities but face challenges such as hallucination and outdated knowledge. Retrieval-Augmented Generation (RAG) has emerged as a state-of-the-art approach to mitigate these issues. While RAG enhances LLM outputs, it remains vulnerable to poisoning attacks. Recent studies show that injecting poisoned text into the knowledge database can compromise RAG systems, but most existing attacks assume that the attacker can insert a sufficient number of poisoned texts per query to outnumber correct-answer texts in retrieval, an assumption that is often unrealistic. To address this limitation, we propose CorruptRAG, a practical poisoning attack against RAG systems in which the attacker injects only a single poisoned text, enhancing both feasibility and stealth. Extensive experiments conducted on multiple large-scale datasets demonstrate that CorruptRAG achieves higher attack success rates than existing baselines.",https://www.semanticscholar.org/paper/72047a3141cffe6c4564258212c5d648cad1e36f,arXiv.org,retrieval augmented generation
