paper_id,title,authors,year,citation_count,abstract,url,venue,keyword
11f0642a81afb6aaea49e4f46673c361f4a948df,MoC: Mixtures of Text Chunking Learners for Retrieval-Augmented Generation System,"Jihao Zhao, Zhiyuan Ji, Jason Zhaoxin Fan, Hanyu Wang, Simin Niu, Bo Tang, Feiyu Xiong, Zhiyu Li",2025,18,"Retrieval-Augmented Generation (RAG), while serving as a viable complement to large language models (LLMs), often overlooks the crucial aspect of text chunking within its pipeline. This paper initially introduces a dual-metric evaluation method, comprising Boundary Clarity and Chunk Stickiness, to enable the direct quantification of chunking quality. Leveraging this assessment method, we highlight the inherent limitations of traditional and semantic chunking in handling complex contextual nuances, thereby substantiating the necessity of integrating LLMs into chunking process. To address the inherent trade-off between computational efficiency and chunking precision in LLM-based approaches, we devise the granularity-aware Mixture-of-Chunkers (MoC) framework, which consists of a three-stage processing mechanism. Notably, our objective is to guide the chunker towards generating a structured list of chunking regular expressions, which are subsequently employed to extract chunks from the original text. Extensive experiments demonstrate that both our proposed metrics and the MoC framework effectively settle challenges of the chunking task, revealing the chunking kernel while enhancing the performance of the RAG system.",https://www.semanticscholar.org/paper/11f0642a81afb6aaea49e4f46673c361f4a948df,Annual Meeting of the Association for Computational Linguistics,retrieval augmented generation
71b45d00f0239eb098462f2a8d94e41b9d2040bc,Robust Fine-tuning for Retrieval Augmented Generation against Retrieval Defects,"Yiteng Tu, Weihang Su, Yujia Zhou, Yiqun Liu, Qingyao Ai",2025,20,"Retrieval-augmented generation (RAG) enhances large language models (LLMs) by integrating external knowledge retrieved from a knowledge base. However, its effectiveness is fundamentally constrained by the reliability of both the retriever and the knowledge base (i.e., the retrieval system). In real-world scenarios, imperfections in these components often lead to the retrieval of noisy, irrelevant, or misleading counterfactual information, ultimately undermining the trustworthiness of RAG systems. To address this challenge, we propose Robust Fine-Tuning (RbFT), a method designed to enhance the resilience of LLMs against retrieval defects through two targeted fine-tuning tasks. Experimental results demonstrate that RbFT significantly improves the robustness of RAG systems across diverse retrieval conditions, surpassing existing methods while maintaining high inference efficiency and compatibility with other robustness techniques.",https://www.semanticscholar.org/paper/71b45d00f0239eb098462f2a8d94e41b9d2040bc,Annual International ACM SIGIR Conference on Research and Development in Information Retrieval,retrieval augmented generation
dfd65a262adc398bbd8ae2d79a86086539fcbe51,Hyper-RAG: Combating LLM Hallucinations using Hypergraph-Driven Retrieval-Augmented Generation,"Yifan Feng, Hao Hu, Xingliang Hou, Shiquan Liu, Shihui Ying, Shaoyi Du, Han Hu, Yue Gao",2025,15,"Large language models (LLMs) have transformed various sectors, including education, finance, and medicine, by enhancing content generation and decision-making processes. However, their integration into the medical field is cautious due to hallucinations, instances where generated content deviates from factual accuracy, potentially leading to adverse outcomes. To address this, we introduce Hyper-RAG, a hypergraph-driven Retrieval-Augmented Generation method that comprehensively captures both pairwise and beyond-pairwise correlations in domain-specific knowledge, thereby mitigating hallucinations. Experiments on the NeurologyCrop dataset with six prominent LLMs demonstrated that Hyper-RAG improves accuracy by an average of 12.3% over direct LLM use and outperforms Graph RAG and Light RAG by 6.3% and 6.0%, respectively. Additionally, Hyper-RAG maintained stable performance with increasing query complexity, unlike existing methods which declined. Further validation across nine diverse datasets showed a 35.5% performance improvement over Light RAG using a selection-based assessment. The lightweight variant, Hyper-RAG-Lite, achieved twice the retrieval speed and a 3.3% performance boost compared with Light RAG. These results confirm Hyper-RAG's effectiveness in enhancing LLM reliability and reducing hallucinations, making it a robust solution for high-stakes applications like medical diagnostics.",https://www.semanticscholar.org/paper/dfd65a262adc398bbd8ae2d79a86086539fcbe51,arXiv.org,retrieval augmented generation
7477bccbe3683c49a9d6c50f901569d87ca07ce5,"A Systematic Literature Review of Retrieval-Augmented Generation: Techniques, Metrics, and Challenges","Andrew Brown, Muhammad Roman, Barry Devereux",2025,16,"Background: Retrieval-augmented generation (RAG) aims to reduce hallucinations and outdated knowledge by grounding LLM outputs in retrieved evidence, but empirical results are scattered across tasks, systems, and metrics, limiting cumulative insight. Objective: We aimed to synthesise empirical evidence on RAG effectiveness versus parametric-only baselines, map datasets/architectures/evaluation practices, and surface limitations and research gaps. Methods: This systematic review was conducted and reported in accordance with PRISMA 2020. We searched the ACM Digital Library, IEEE Xplore, Scopus, ScienceDirect, and DBLP; all sources were last searched on 13 May 2025. This included studies from January 2020–May 2025 that addressed RAG or similar retrieval-supported systems producing text output, met citation thresholds (≥15 for 2025; ≥30 for 2024 or earlier), and offered original contributions; excluded non-English items, irrelevant works, duplicates, and records without accessible full text. Bias was appraised with a brief checklist; screening used one reviewer with an independent check and discussion. LLM suggestions were advisory only; 2025 citation thresholds were adjusted to limit citation-lag. We used a descriptive approach to synthesise the results, organising studies by themes aligned to RQ1–RQ4 and reporting summary counts/frequencies; no meta-analysis was undertaken due to heterogeneity of designs and metrics. Results: We included 128 studies spanning knowledge-intensive tasks (35/128; 27.3%), open-domain QA (20/128; 15.6%), software engineering (13/128; 10.2%), and medical domains (11/128; 8.6%). Methods have shifted from DPR+seq2seq baselines to modular, policy-driven RAG with hybrid/structure-aware retrieval, uncertainty-triggered loops, memory, and emerging multimodality. Evaluation remains overlap-heavy (EM/F1), with increasing use of retrieval diagnostics (e.g., Recall@k, MRR@k), human judgements, and LLM-as-judge protocols. Efficiency and security (poisoning, leakage, jailbreaks) are growing concerns. Discussion: Evidence supports a shift to modular, policy-driven RAG, combining hybrid/structure-aware retrieval, uncertainty-aware control, memory, and multimodality, to improve grounding and efficiency. To advance from prototypes to dependable systems, we recommend: (i) holistic benchmarks pairing quality with cost/latency and safety, (ii) budget-aware retrieval/tool-use policies, and (iii) provenance-aware pipelines that expose uncertainty and deliver traceable evidence. We note the evidence base may be affected by citation-lag from the inclusion thresholds and by English-only, five-library coverage. Funding: Advanced Research and Engineering Centre. Registration: Not registered.",https://www.semanticscholar.org/paper/7477bccbe3683c49a9d6c50f901569d87ca07ce5,Big Data and Cognitive Computing,retrieval augmented generation
8f323e932374e158cb4ceb4376c9b0ab2ac35a1f,Cache-Craft: Managing Chunk-Caches for Efficient Retrieval-Augmented Generation,"Shubham Agarwal, Sai Narayan Sundaresan, Subrata Mitra, Debabrata Mahapatra, Archit Gupta, Rounak Sharma, Nirmal Joshua Kapu, Tong Yu, S. Saini",2025,21,"Retrieval-Augmented Generation (RAG) is often used with Large Language Models (LLMs) to infuse domain knowledge or user-specific information. In RAG, given a user query, a retriever extracts chunks of relevant text from a knowledge base. These chunks are sent to an LLM as part of the input prompt. Typically, any given chunk is repeatedly retrieved across user questions. However, currently, for every question, attention layers in LLMs fully compute the Keys and Values (KVs) repeatedly for the input chunks, as state-of-the-art methods cannot reuse KV-caches when chunks appear at arbitrary locations or with arbitrary contexts. Naive reuse leads to output quality degradation. This leads to potentially redundant computations on expensive GPUs and increases latency. In this work, we propose Cache-Craft, a system for managing and reusing precomputed KVs corresponding to the text chunks (which we call chunk-caches) in RAG-based systems. We present how to identify chunk-caches that are reusable, how to efficiently perform a small fraction of recomputation to fix the cache and maintain output quality, and how to efficiently store and evict chunk-caches in the hardware for maximizing reuse while masking any overheads. With real production workloads as well as synthetic datasets, we show that Cache-Craft reduces redundant computation by 51% over SOTA prefix-caching and 75% over full recomputation. Additionally, with continuous batching on a real production workload, we get a 1.6× speed up in throughput for both the LLama-3-8B and 70B models and a 2.1× and 2× reduction in end-to-end response latency respectively, compared to prefix-caching, while maintaining generation quality.",https://www.semanticscholar.org/paper/8f323e932374e158cb4ceb4376c9b0ab2ac35a1f,,retrieval augmented generation
f83cd6199dae26a322b9908b68408307950f76b7,A Multimodal Framework Embedding Retrieval-Augmented Generation with MLLMs for Eurobarometer Data,"George Papageorgiou, Vangelis Sarlis, Manolis Maragoudakis, Christos Tjortjis",2025,17,"This study introduces a multimodal framework integrating retrieval-augmented generation (RAG) with multimodal large language models (MLLMs) to enhance the accessibility, interpretability, and analysis of Eurobarometer survey data. Traditional approaches often struggle with the diverse formats and large-scale nature of these datasets, which include textual and visual elements. The proposed framework leverages multimodal indexing and targeted retrieval to enable focused queries, trend analysis, and visualization, across multiple survey editions. The integration of LLMs facilitates advanced synthesis of insights, providing a more comprehensive understanding of public opinion trends. The proposed framework offers prospective benefits for different types of stakeholders, including policymakers, journalists, nongovernmental organizations (NGOs), researchers, and citizens, while highlighting the need for performance assessment to evaluate its effectiveness based on specific business requirements and practical applications. The framework’s modular design supports applications, such as survey studies, comparative analyses, and domain-specific investigations, while its scalability and reproducibility make it suitable for e-governance and public sector deployment. The results indicate potential enhancements in data interpretation and data analysis by providing stakeholders with the capability not only to utilize raw text data for knowledge extraction but also to conduct image analysis based on indexed content, paving the way for informed policymaking and advanced research in the social sciences, while emphasizing the need for performance assessment to validate the framework’s output and functionality, based on the selected architectural components. Future research will explore expanded functionalities and real-time applications, ensuring the framework remains adaptable to evolving needs in public opinion analysis and multimodal data integration.",https://www.semanticscholar.org/paper/f83cd6199dae26a322b9908b68408307950f76b7,Applied Informatics,retrieval augmented generation
d00b9b7a22fa0f90a80bcdbd16f03d6a5f6017ba,Retrieval-Augmented Generation with Hierarchical Knowledge,"Haoyu Huang, Yongfeng Huang, Junjie Yang, Zhenyu Pan, Yongqiang Chen, Kaili Ma, Hongzhi Chen, James Cheng",2025,23,"Graph-based Retrieval-Augmented Generation (RAG) methods have significantly enhanced the performance of large language models (LLMs) in domain-specific tasks. However, existing RAG methods do not adequately utilize the naturally inherent hierarchical knowledge in human cognition, which limits the capabilities of RAG systems. In this paper, we introduce a new RAG approach, called HiRAG, which utilizes hierarchical knowledge to enhance the semantic understanding and structure capturing capabilities of RAG systems in the indexing and retrieval processes. Our extensive experiments demonstrate that HiRAG achieves significant performance improvements over the state-of-the-art baseline methods.",https://www.semanticscholar.org/paper/d00b9b7a22fa0f90a80bcdbd16f03d6a5f6017ba,Conference on Empirical Methods in Natural Language Processing,retrieval augmented generation
fef4addeb817b6594c426c352ee6ff3cba67fdba,ArchRAG: Attributed Community-based Hierarchical Retrieval-Augmented Generation,"Shu Wang, Yixiang Fang, Yingli Zhou, Xilin Liu, Yuchi Ma",2025,20,"Retrieval-Augmented Generation (RAG) has proven effective in integrating external knowledge into large language models (LLMs) for solving question-answer (QA) tasks. The state-of-the-art RAG approaches often use the graph data as the external data since they capture the rich semantic information and link relationships between entities. However, existing graph-based RAG approaches cannot accurately identify the relevant information from the graph and also consume large numbers of tokens in the online retrieval process. To address these issues, we introduce a novel graph-based RAG approach, called Attributed Community-based Hierarchical RAG (ArchRAG), by augmenting the question using attributed communities, and also introducing a novel LLM-based hierarchical clustering method. To retrieve the most relevant information from the graph for the question, we build a novel hierarchical index structure for the attributed communities and develop an effective online retrieval method. Experimental results demonstrate that ArchRAG outperforms existing methods in both accuracy and token cost.",https://www.semanticscholar.org/paper/fef4addeb817b6594c426c352ee6ff3cba67fdba,AAAI Conference on Artificial Intelligence,retrieval augmented generation
1717ec916c1e092facaaeb22fd8fe26b172eb388,FinDER: Financial Dataset for Question Answering and Evaluating Retrieval-Augmented Generation,"Chanyeol Choi, Jihoon Kwon, Jaeseon Ha, Hojun Choi, Chaewoon Kim, Yongjae Lee, Jy-yong Sohn, Alejandro Lopez-Lira",2025,17,"In the fast-paced financial domain, accurate and up-to-date information is critical to addressing ever-evolving market conditions. Retrieving this information correctly is essential in financial Question-Answering (QA), since many language models struggle with factual accuracy in this domain. We present FinDER, an expert-generated dataset tailored for Retrieval-Augmented Generation (RAG) in finance. Unlike existing QA datasets that provide predefined contexts and rely on relatively clear and straightforward queries, FinDER focuses on annotating search-relevant evidence by domain experts, offering 5,703 query–evidence–answer triplets derived from real-world financial inquiries. These queries frequently include abbreviations, acronyms, and concise expressions, capturing the brevity and ambiguity common in the realistic search behavior of professionals. By challenging models to retrieve relevant information from large corpora rather than relying on readily determined contexts, FinDER offers a more realistic benchmark for evaluating RAG systems. We further present a comprehensive evaluation of multiple state-of-the-art retrieval models and Large Language Models, showcasing challenges derived from a realistic benchmark to drive future research on truthful and precise RAG in the financial domain. We will release the dataset publicly upon acceptance of the paper.",https://www.semanticscholar.org/paper/1717ec916c1e092facaaeb22fd8fe26b172eb388,International Conference on AI in Finance,retrieval augmented generation
403bd2292154cf84bfaebe440ebd642b623839f1,PR-Attack: Coordinated Prompt-RAG Attacks on Retrieval-Augmented Generation in Large Language Models via Bilevel Optimization,"Yang Jiao, Xiaodong Wang, Kai Yang",2025,17,"Large Language Models (LLMs) have demonstrated remarkable performance across a wide range of applications, e.g., medical question-answering, mathematical sciences, and code generation. However, they also exhibit inherent limitations, such as outdated knowledge and susceptibility to hallucinations. Retrieval-Augmented Generation (RAG) has emerged as a promising paradigm to address these issues, but it also introduces new vulnerabilities. Recent efforts have focused on the security of RAG-based LLMs, yet existing attack methods face three critical challenges: (1) their effectiveness declines sharply when only a limited number of poisoned texts can be injected into the knowledge database (2) they lack sufficient stealth, as the attacks are often detectable by anomaly detection systems, which compromises their effectiveness, and (3) they rely on heuristic approaches to generate poisoned texts, lacking formal optimization frameworks and theoretic guarantees, which limits their effectiveness and applicability. To address these issues, we propose coordinated Prompt-RAG attack (PR-attack), a novel optimization-driven attack that introduces a small number of poisoned texts into the knowledge database while embedding a backdoor trigger within the prompt. When activated, the trigger causes the LLM to generate pre-designed responses to targeted queries, while maintaining normal behavior in other contexts. This ensures both high effectiveness and stealth. We formulate the attack generation process as a bilevel optimization problem leveraging a principled optimization framework to develop optimal poisoned texts and triggers. Extensive experiments across diverse LLMs and datasets demonstrate the effectiveness of PR-Attack, achieving a high attack success rate even with a limited number of poisoned texts and significantly improved stealth compared to existing methods. These results highlight the potential risks posed by PR-Attack and emphasize the importance of securing RAG-based LLMs against such threats.",https://www.semanticscholar.org/paper/403bd2292154cf84bfaebe440ebd642b623839f1,Annual International ACM SIGIR Conference on Research and Development in Information Retrieval,retrieval augmented generation
ea2f72b979e2646dec92a9ce9b6b07dd0a20e789,"Retrieval-Augmented Generation in Biomedicine: A Survey of Technologies, Datasets, and Clinical Applications","Jiawei He, Boya Zhang, H. Rouhizadeh, Yingjian Chen, Rui Yang, Jin Lu, Xudong Chen, Nan Liu, Irene Li, Douglas Teodoro",2025,15,"Large language models (LLMs) in biomedicine face a fundamental conflict between static parameter knowledge and the dynamic nature of clinical evidence. Retrieval-Augmented Generation (RAG) addresses this by grounding generation in external data, yet it introduces new complexities in latency and architecture. This survey synthesizes the biomedical RAG landscape (2020-2025), classifying systems into naive, advanced, and modular paradigms. Beyond a technological taxonomy, we formalize the biomedical RAG trilemma, identifying the inherent trade-offs between reasoning depth, inference latency, and data privacy that constrain current clinical deployment. We analyze how recent agentic workflows enhance diagnostic reasoning but risk prohibitive latency, and how privacy constraints dictate the choice between powerful cloud-based models and local deployment. Finally, we outline the alignment gap in multimodal RAG and propose future directions for self-correcting, verifiable clinical agents.",https://www.semanticscholar.org/paper/ea2f72b979e2646dec92a9ce9b6b07dd0a20e789,,retrieval augmented generation
f741edf18770aaedc20a807648fe214cb012eb99,RAG-RL: Advancing Retrieval-Augmented Generation via RL and Curriculum Learning,"Jerry Huang, Siddarth Madala, Risham Sidhu, Cheng Niu, J. Hockenmaier, Tong Zhang",2025,25,"Retrieval-augmented generation (RAG) systems rely on retrieval models for identifying relevant contexts and answer generation models for utilizing those contexts. However, retrievers exhibit imperfect recall and precision, limiting downstream performance. We introduce RAG-RL, an answer generation model trained not only to produce answers but also to identify and cite relevant information from larger sets of retrieved contexts, shifting some of the burden of identifying relevant documents from the retriever to the answer generator. Our approach uses curriculum learning, where the model is first trained on easier examples that include only relevant contexts. Our experiments show that these training samples enable models to acquire citation and reasoning skills with greater sample efficiency and generalizability, demonstrating strong model performance even as the number of irrelevant passages increases. We benchmark our methods on three open-domain multi-hop question answering datasets and report significant gains in answer and citation accuracy. Our experiments provide empirical insights into how easier training samples can give models stronger signals for learning specific skills (e.g., citation generation) and how different components of post-training (e.g., training set construction, rule-based rewards, training sample ordering, etc.) impact final model performance.",https://www.semanticscholar.org/paper/f741edf18770aaedc20a807648fe214cb012eb99,arXiv.org,retrieval augmented generation
f716a18b462826004899010dfc30947f9c01ef90,RAG LLMs are Not Safer: A Safety Analysis of Retrieval-Augmented Generation for Large Language Models,"Shiyue Zhang, M. Dredze, AI Bloomberg, M. Zitnik, Meng Jiang, Mohit Bansal, James Zou, Jian Pei, Jian Liu, Jianfeng Gao, Jiawei Han, Jieyu Zhao, Jiliang Tang, Jindong Wang, Joaquin Vanschoren, John C. Mitchell, Kai Shu, Kaidi Xu, Kai-Wei Chang, Lifang He, Lifu Huang, Michael Backes, Aaron Hurst, Adam Lerer, Adam P. Goucher, Adam Perelman, Aditya Ramesh, Aidan Clark, AJ Os-trow, Akila Welihinda, Alan Hayes, Alec Radford, Alon Jacovi, Andrew Wang, Chris Alberti, Connie Tao, Jon Lipovetz, Kate Olszewska, Lukas Haas, Michelle Liu, Nate Keating, Adam E. Bloniarz, Carl Saroufim, Corey Fry, Dror Marcus, Doron Kukliansky, Gau-rav Singh Tomar, James Swirhun, J. Xing, Lily Wang, Madhu Gurumurthy, Michael Aaron, Moran Ambar, Rachana Fellinger, Rui Wang, Zizhao Zhang, S. Goldshtein, Dipanjan Das. 2025, Neel Jain, Avi Schwarzschild, Yuxin Wen, Gowthami Somepalli, John Kirchenbauer, Ping-yeh Chiang, Micah Goldblum, Aniruddha Saha, Jonas Geiping, Tom Goldstein. 2023, Jiaming Ji, Mickel Liu, Josef Dai, Xuehai Pan, Chi Zhang, Juntao Dai, Tianyi Qiu, Bo Chen, Borong Zhang, Hantao Lou, Kaile Wang, Ya Duan",2025,25,"Efforts to ensure the safety of large language models (LLMs) include safety fine-tuning, evaluation, and red teaming. However, despite the widespread use of the Retrieval-Augmented Generation (RAG) framework, AI safety work focuses on standard LLMs, which means we know little about how RAG use cases change a model's safety profile. We conduct a detailed comparative analysis of RAG and non-RAG frameworks with eleven LLMs. We find that RAG can make models less safe and change their safety profile. We explore the causes of this change and find that even combinations of safe models with safe documents can cause unsafe generations. In addition, we evaluate some existing red teaming methods for RAG settings and show that they are less effective than when used for non-RAG settings. Our work highlights the need for safety research and red-teaming methods specifically tailored for RAG LLMs.",https://www.semanticscholar.org/paper/f716a18b462826004899010dfc30947f9c01ef90,North American Chapter of the Association for Computational Linguistics,retrieval-augmented generation
