paper_id,title,authors,year,citation_count,abstract,url,venue,keyword
fa21931a9b23a7f0b7c4975a661d9ccc8e84d059,ChatQA: Surpassing GPT-4 on Conversational QA and RAG,"Zihan Liu, Wei Ping, Rajarshi Roy, Peng Xu, Chankyu Lee, M. Shoeybi, Bryan Catanzaro",2024,100,"In this work, we introduce ChatQA, a suite of models that outperform GPT-4 on retrieval-augmented generation (RAG) and conversational question answering (QA). To enhance generation, we propose a two-stage instruction tuning method that significantly boosts the performance of RAG. For effective retrieval, we introduce a dense retriever optimized for conversational QA, which yields results comparable to the alternative state-of-the-art query rewriting models, while substantially reducing deployment costs. We also present the ChatRAG Bench, which encompasses ten datasets covering comprehensive evaluations on RAG, table-related QA, arithmetic calculations, and scenarios involving unanswerable questions. Our ChatQA-1.0-70B (score: 54.14), built on Llama2, a weaker foundation model than GPT-4, can slightly outperform GPT-4-0613 (score: 53.90) and GPT-4-Turbo-2024-04-09 (score: 54.03) on the ChatRAG Bench, without relying on any synthetic data from OpenAI GPT models. Notably, the Llama3-ChatQA-1.5-70B model surpasses the accuracy of GPT-4-Turbo-2024-04-09, achieving a 4.4% improvement. To advance research in this field, we open-sourced the model weights, instruction tuning data, ChatRAG Bench, and retriever for the community: https://chatqa-project.github.io/.",https://www.semanticscholar.org/paper/fa21931a9b23a7f0b7c4975a661d9ccc8e84d059,Neural Information Processing Systems,RAG
176793264b4344a598d301dcfb8d43e13f323ef0,Vul-RAG: Enhancing LLM-based Vulnerability Detection via Knowledge-level RAG,"Xueying Du, G. Zheng, Kaixin Wang, Yi Zou, Yujia Wang, Wentai Deng, Jiayi Feng, Mingwei Liu, Bihuan Chen, Xin Peng, Tao Ma, Yiling Lou",2024,107,"Although LLMs have shown promising potential in vulnerability detection, this study reveals their limitations in distinguishing between vulnerable and similar-but-benign patched code (only 0.06 - 0.14 accuracy). It shows that LLMs struggle to capture the root causes of vulnerabilities during vulnerability detection. To address this challenge, we propose enhancing LLMs with multi-dimensional vulnerability knowledge distilled from historical vulnerabilities and fixes. We design a novel knowledge-level Retrieval-Augmented Generation framework Vul-RAG, which improves LLMs with an accuracy increase of 16% - 24% in identifying vulnerable and patched code. Additionally, vulnerability knowledge generated by Vul-RAG can further (1) serve as high-quality explanations to improve manual detection accuracy (from 60% to 77%), and (2) detect 10 previously-unknown bugs in the recent Linux kernel release with 6 assigned CVEs.",https://www.semanticscholar.org/paper/176793264b4344a598d301dcfb8d43e13f323ef0,ACM Transactions on Software Engineering and Methodology,RAG
3daedc1e0a9db8c4dda7e06724b0b556f64c0752,LegalBench-RAG: A Benchmark for Retrieval-Augmented Generation in the Legal Domain,"Nicholas Pipitone, Ghita Houir Alami",2024,100,"Retrieval-Augmented Generation (RAG) systems are showing promising potential, and are becoming increasingly relevant in AI-powered legal applications. Existing benchmarks, such as LegalBench, assess the generative capabilities of Large Language Models (LLMs) in the legal domain, but there is a critical gap in evaluating the retrieval component of RAG systems. To address this, we introduce LegalBench-RAG, the first benchmark specifically designed to evaluate the retrieval step of RAG pipelines within the legal space. LegalBench-RAG emphasizes precise retrieval by focusing on extracting minimal, highly relevant text segments from legal documents. These highly relevant snippets are preferred over retrieving document IDs, or large sequences of imprecise chunks, both of which can exceed context window limitations. Long context windows cost more to process, induce higher latency, and lead LLMs to forget or hallucinate information. Additionally, precise results allow LLMs to generate citations for the end user. The LegalBench-RAG benchmark is constructed by retracing the context used in LegalBench queries back to their original locations within the legal corpus, resulting in a dataset of 6,858 query-answer pairs over a corpus of over 79M characters, entirely human-annotated by legal experts. We also introduce LegalBench-RAG-mini, a lightweight version for rapid iteration and experimentation. By providing a dedicated benchmark for legal retrieval, LegalBench-RAG serves as a critical tool for companies and researchers focused on enhancing the accuracy and performance of RAG systems in the legal domain. The LegalBench-RAG dataset is publicly available at https://github.com/zeroentropy-cc/legalbenchrag.",https://www.semanticscholar.org/paper/3daedc1e0a9db8c4dda7e06724b0b556f64c0752,arXiv.org,RAG
98cb07d3e50f0718ff17eca4e898f451e0f3381d,MMed-RAG: Versatile Multimodal RAG System for Medical Vision Language Models,"Peng Xia, Peng Xia, Kangyu Zhu, Haoran Li, Haoran Li, Weijia Shi, Sheng Wang, Linjun Zhang, James Zou, Huaxiu Yao",2024,101,"Artificial Intelligence (AI) has demonstrated significant potential in healthcare, particularly in disease diagnosis and treatment planning. Recent progress in Medical Large Vision-Language Models (Med-LVLMs) has opened up new possibilities for interactive diagnostic tools. However, these models often suffer from factual hallucination, which can lead to incorrect diagnoses. Fine-tuning and retrieval-augmented generation (RAG) have emerged as methods to address these issues. However, the amount of high-quality data and distribution shifts between training data and deployment data limit the application of fine-tuning methods. Although RAG is lightweight and effective, existing RAG-based approaches are not sufficiently general to different medical domains and can potentially cause misalignment issues, both between modalities and between the model and the ground truth. In this paper, we propose a versatile multimodal RAG system, MMed-RAG, designed to enhance the factuality of Med-LVLMs. Our approach introduces a domain-aware retrieval mechanism, an adaptive retrieved contexts selection method, and a provable RAG-based preference fine-tuning strategy. These innovations make the RAG process sufficiently general and reliable, significantly improving alignment when introducing retrieved contexts. Experimental results across five medical datasets (involving radiology, ophthalmology, pathology) on medical VQA and report generation demonstrate that MMed-RAG can achieve an average improvement of 43.8% in the factual accuracy of Med-LVLMs. Our data and code are available in https://github.com/richard-peng-xia/MMed-RAG.",https://www.semanticscholar.org/paper/98cb07d3e50f0718ff17eca4e898f451e0f3381d,International Conference on Learning Representations,RAG
ec1bec009e68a4df478aaf11e3615e5587768990,CRAG - Comprehensive RAG Benchmark,"Xiao Yang, Kai Sun, Hao Xin, Yushi Sun, N. Bhalla, Xiangsen Chen, Sajal Choudhary, R. Gui, Ziran Jiang, Ziyu Jiang, Lingkun Kong, Brian Moran, Jiaqi Wang, Y. Xu, An Yan, Chenyu Yang, E. Yuan, Hanwen Zha, Nan Tang, Lei Chen, Nicolas Scheffer, Yue Liu, Nirav Shah, Rakesh Wanga, Anuj Kumar, Wen-tau Yih, Xin Dong",2024,99,"Retrieval-Augmented Generation (RAG) has recently emerged as a promising solution to alleviate Large Language Model (LLM)'s deficiency in lack of knowledge. Existing RAG datasets, however, do not adequately represent the diverse and dynamic nature of real-world Question Answering (QA) tasks. To bridge this gap, we introduce the Comprehensive RAG Benchmark (CRAG), a factual question answering benchmark of 4,409 question-answer pairs and mock APIs to simulate web and Knowledge Graph (KG) search. CRAG is designed to encapsulate a diverse array of questions across five domains and eight question categories, reflecting varied entity popularity from popular to long-tail, and temporal dynamisms ranging from years to seconds. Our evaluation of this benchmark highlights the gap to fully trustworthy QA. Whereas most advanced LLMs achieve<=34% accuracy on CRAG, adding RAG in a straightforward manner improves the accuracy only to 44%. State-of-the-art industry RAG solutions only answer 63% of questions without any hallucination. CRAG also reveals much lower accuracy in answering questions regarding facts with higher dynamism, lower popularity, or higher complexity, suggesting future research directions. The CRAG benchmark laid the groundwork for a KDD Cup 2024 challenge and attracted thousands of participants and submissions. We commit to maintaining CRAG to serve research communities in advancing RAG solutions and general QA solutions. CRAG is available at https://github.com/facebookresearch/CRAG/.",https://www.semanticscholar.org/paper/ec1bec009e68a4df478aaf11e3615e5587768990,Neural Information Processing Systems,RAG
e2050c0aa8aa27235c0708b5a5ff741dfd11e2a9,CRUD-RAG: A Comprehensive Chinese Benchmark for Retrieval-Augmented Generation of Large Language Models,"Yuanjie Lyu, Zhiyu Li, Simin Niu, Feiyu Xiong, Bo Tang, Wenjin Wang, Hao Wu, Huan Liu, Tong Xu, Enhong Chen",2024,97,"Retrieval-augmented generation (RAG) is a technique that enhances the capabilities of large language models (LLMs) by incorporating external knowledge sources. This method addresses common LLM limitations, including outdated information and the tendency to produce inaccurate “hallucinated” content. However, evaluating RAG systems is a challenge. Most benchmarks focus primarily on question-answering applications, neglecting other potential scenarios where RAG could be beneficial. Accordingly, in the experiments, these benchmarks often assess only the LLM components of the RAG pipeline or the retriever in knowledge-intensive scenarios, overlooking the impact of external knowledge base construction and the retrieval component on the entire RAG pipeline in non-knowledge-intensive scenarios. To address these issues, this article constructs a large-scale and more comprehensive benchmark and evaluates all the components of RAG systems in various RAG application scenarios. Specifically, we refer to the CRUD actions that describe interactions between users and knowledge bases and also categorize the range of RAG applications into four distinct types—create, read, update, and delete (CRUD). “Create” refers to scenarios requiring the generation of original, varied content. “Read” involves responding to intricate questions in knowledge-intensive situations. “Update” focuses on revising and rectifying inaccuracies or inconsistencies in pre-existing texts. “Delete” pertains to the task of summarizing extensive texts into more concise forms. For each of these CRUD categories, we have developed different datasets to evaluate the performance of RAG systems. We also analyze the effects of various components of the RAG system, such as the retriever, context length, knowledge base construction, and LLM. Finally, we provide useful insights for optimizing the RAG technology for different scenarios. The source code is available at GitHub: https://github.com/IAAR-Shanghai/CRUD_RAG.",https://www.semanticscholar.org/paper/e2050c0aa8aa27235c0708b5a5ff741dfd11e2a9,,RAG
b40d9ad792fddb69fa48cca6f0a9b68d3ead749c,Summary of a Haystack: A Challenge to Long-Context LLMs and RAG Systems,"Philippe Laban, A. R. Fabbri, Caiming Xiong, Chien-Sheng Wu",2024,95,"LLMs and RAG systems are now capable of handling millions of input tokens or more. However, evaluating the output quality of such systems on long-context tasks remains challenging, as tasks like Needle-in-a-Haystack lack complexity. In this work, we argue that summarization can play a central role in such evaluation. We design a procedure to synthesize Haystacks of documents, ensuring that specific insights repeat across documents. The “Summary of a Haystack” (SummHay) task then requires a system to process the Haystack and generate, given a query, a summary that identifies the relevant insights and precisely cites the source documents. Since we have precise knowledge of what insights should appear in a haystack summary and what documents should be cited, we implement a highly reproducible automatic evaluation that can score summaries on two aspects – Coverage and Citation. We generate Haystacks in two domains (conversation, news), and perform a large-scale evaluation of 10 LLMs and corresponding 50 RAG systems. Our findings indicate that SummHay is an open challenge for current systems, as even systems provided with an Oracle signal of document relevance lag our estimate of human performance (56%) by 10+ points on a Joint Score. Without a retriever, long-context LLMs like GPT-4o and Claude 3 Opus score below 20% on SummHay. We show SummHay can also be used to study enterprise RAG systems and position bias in long-context models. We hope future systems can equal and surpass human performance on SummHay.",https://www.semanticscholar.org/paper/b40d9ad792fddb69fa48cca6f0a9b68d3ead749c,Conference on Empirical Methods in Natural Language Processing,RAG
7f254928af6718c80224199e9cd915e7372ac54d,RAG-Driver: Generalisable Driving Explanations with Retrieval-Augmented In-Context Learning in Multi-Modal Large Language Model,"Jianhao Yuan, Shuyang Sun, Daniel Omeiza, Bo Zhao, Paul Newman, Lars Kunze, Matthew Gadd",2024,95,"We need to trust robots that use often opaque AI methods. They need to explain themselves to us, and we need to trust their explanation. In this regard, explainability plays a critical role in trustworthy autonomous decision-making to foster transparency and acceptance among end users, especially in complex autonomous driving. Recent advancements in Multi-Modal Large Language models (MLLMs) have shown promising potential in enhancing the explainability as a driving agent by producing control predictions along with natural language explanations. However, severe data scarcity due to expensive annotation costs and significant domain gaps between different datasets makes the development of a robust and generalisable system an extremely challenging task. Moreover, the prohibitively expensive training requirements of MLLM and the unsolved problem of catastrophic forgetting further limit their generalisability post-deployment. To address these challenges, we present RAG-Driver, a novel retrieval-augmented multi-modal large language model that leverages in-context learning for high-performance, explainable, and generalisable autonomous driving. By grounding in retrieved expert demonstration, we empirically validate that RAG-Driver achieves state-of-the-art performance in producing driving action explanations, justifications, and control signal prediction. More importantly, it exhibits exceptional zero-shot generalisation capabilities to unseen environments without further training endeavours.",https://www.semanticscholar.org/paper/7f254928af6718c80224199e9cd915e7372ac54d,,RAG
9e4e3132dd293b12b18fb1d7a82b28509d1cd0e6,RULE: Reliable Multimodal RAG for Factuality in Medical Vision Language Models,"Peng Xia, Kangyu Zhu, Haoran Li, Hongtu Zhu, Yun Li, Gang Li, Linjun Zhang, Huaxiu Yao",2024,92,"The recent emergence of Medical Large Vision Language Models (Med-LVLMs) has enhanced medical diagnosis. However, current Med-LVLMs frequently encounter factual issues, often generating responses that do not align with established medical facts. Retrieval-Augmented Generation (RAG), which utilizes external knowledge, can improve the factual accuracy of these models but introduces two major challenges. First, limited retrieved contexts might not cover all necessary information, while excessive retrieval can introduce irrelevant and inaccurate references, interfering with the model’s generation. Second, in cases where the model originally responds correctly, applying RAG can lead to an over-reliance on retrieved contexts, resulting in incorrect answers. To address these issues, we propose RULE, which consists of two components. First, we introduce a provably effective strategy for controlling factuality risk through the calibrated selection of the number of retrieved contexts. Second, based on samples where over-reliance on retrieved contexts led to errors, we curate a preference dataset to fine-tune the model, balancing its dependence on inherent knowledge and retrieved contexts for generation. We demonstrate the effectiveness of RAFE on three medical VQA datasets, achieving an average improvement of 20.8% in factual accuracy.",https://www.semanticscholar.org/paper/9e4e3132dd293b12b18fb1d7a82b28509d1cd0e6,Conference on Empirical Methods in Natural Language Processing,RAG
b4d1da748ba87f38150ad38e30be68f3584ae462,RAG-Fusion: a New Take on Retrieval-Augmented Generation,Zackary Rackauckas,2024,89,"Infineon has identified a need for engineers, account managers, and customers to rapidly obtain product information. This problem is traditionally addressed with retrieval-augmented generation (RAG) chatbots, but in this study, I evaluated the use of the newly popularized RAG-Fusion method. RAG-Fusion combines RAG and reciprocal rank fusion (RRF) by generating multiple queries, reranking them with reciprocal scores and fusing the documents and scores. Through manually evaluating answers on accuracy, relevance, and comprehensiveness, I found that RAG-Fusion was able to provide accurate and comprehensive answers due to the generated queries contextualizing the original query from various perspectives. However, some answers strayed off topic when the generated queries' relevance to the original query is insufficient. This research marks significant progress in artificial intelligence (AI) and natural language processing (NLP) applications and demonstrates transformations in a global and multiindustry context.",https://www.semanticscholar.org/paper/b4d1da748ba87f38150ad38e30be68f3584ae462,International Journal on Natural Language Computing,RAG
160924af0791331ec8fa5a3d526ea125355f3b8b,Speculative RAG: Enhancing Retrieval Augmented Generation through Drafting,"Zilong Wang, Zifeng Wang, Long T. Le, Huaixiu Steven Zheng, Swaroop Mishra, Vincent Perot, Yuwei Zhang, Anush Mattapalli, Ankur Taly, Jingbo Shang, Chen-Yu Lee, Tomas Pfister",2024,91,"Retrieval augmented generation (RAG) combines the generative abilities of large language models (LLMs) with external knowledge sources to provide more accurate and up-to-date responses. Recent RAG advancements focus on improving retrieval outcomes through iterative LLM refinement or self-critique capabilities acquired through additional instruction tuning of LLMs. In this work, we introduce Speculative RAG - a framework that leverages a larger generalist LM to efficiently verify multiple RAG drafts produced in parallel by a smaller, distilled specialist LM. Each draft is generated from a distinct subset of retrieved documents, offering diverse perspectives on the evidence while reducing input token counts per draft. This approach enhances comprehension of each subset and mitigates potential position bias over long context. Our method accelerates RAG by delegating drafting to the smaller specialist LM, with the larger generalist LM performing a single verification pass over the drafts. Extensive experiments demonstrate that Speculative RAG achieves state-of-the-art performance with reduced latency on TriviaQA, MuSiQue, PopQA, PubHealth, and ARC-Challenge benchmarks. It notably enhances accuracy by up to 12.97% while reducing latency by 50.83% compared to conventional RAG systems on PubHealth.",https://www.semanticscholar.org/paper/160924af0791331ec8fa5a3d526ea125355f3b8b,International Conference on Learning Representations,RAG
4dc4644508a7868ad14f6c2c06a34056c6c333f7,KRAGEN: a knowledge graph-enhanced RAG framework for biomedical problem solving using large language models,"Nicholas Matsumoto, Jay Moran, Hyunjun Choi, Miguel E. Hernandez, Mythreye Venkatesan, Z. Wang, Jason H. Moore",2024,78,"Abstract Motivation Answering and solving complex problems using a large language model (LLM) given a certain domain such as biomedicine is a challenging task that requires both factual consistency and logic, and LLMs often suffer from some major limitations, such as hallucinating false or irrelevant information, or being influenced by noisy data. These issues can compromise the trustworthiness, accuracy, and compliance of LLM-generated text and insights. Results Knowledge Retrieval Augmented Generation ENgine (KRAGEN) is a new tool that combines knowledge graphs, Retrieval Augmented Generation (RAG), and advanced prompting techniques to solve complex problems with natural language. KRAGEN converts knowledge graphs into a vector database and uses RAG to retrieve relevant facts from it. KRAGEN uses advanced prompting techniques: namely graph-of-thoughts (GoT), to dynamically break down a complex problem into smaller subproblems, and proceeds to solve each subproblem by using the relevant knowledge through the RAG framework, which limits the hallucinations, and finally, consolidates the subproblems and provides a solution. KRAGEN’s graph visualization allows the user to interact with and evaluate the quality of the solution’s GoT structure and logic. Availability and implementation KRAGEN is deployed by running its custom Docker containers. KRAGEN is available as open-source from GitHub at: https://github.com/EpistasisLab/KRAGEN.",https://www.semanticscholar.org/paper/4dc4644508a7868ad14f6c2c06a34056c6c333f7,,RAG
d09d91b7294f5e486d00dad2a900cd3c2cbd00b9,RaFe: Ranking Feedback Improves Query Rewriting for RAG,"Shengyu Mao, Yong Jiang, Boli Chen, Xiao Li, Peng Wang, Xinyu Wang, Pengjun Xie, Fei Huang, Huajun Chen, Ningyu Zhang",2024,70,"As Large Language Models (LLMs) and Retrieval Augmentation Generation (RAG) techniques have evolved, query rewriting has been widely incorporated into the RAG system for downstream tasks like open-domain QA. Many works have attempted to utilize small models with reinforcement learning rather than costly LLMs to improve query rewriting. However, current methods require annotations (e.g., labeled relevant documents or downstream answers) or predesigned rewards for feedback, which lack generalization, and fail to utilize signals tailored for query rewriting. In this paper, we propose ours, a framework for training query rewriting models free of annotations. By leveraging a publicly available reranker, ours~provides feedback aligned well with the rewriting objectives. Experimental results demonstrate that ours~can obtain better performance than baselines.",https://www.semanticscholar.org/paper/d09d91b7294f5e486d00dad2a900cd3c2cbd00b9,Conference on Empirical Methods in Natural Language Processing,RAG
26702869774950e03b10a3657bca0621aa0d8d07,KG-RAG: Bridging the Gap Between Knowledge and Creativity,Diego Sanmartin,2024,90,"Ensuring factual accuracy while maintaining the creative capabilities of Large Language Model Agents (LMAs) poses significant challenges in the development of intelligent agent systems. LMAs face prevalent issues such as information hallucinations, catastrophic forgetting, and limitations in processing long contexts when dealing with knowledge-intensive tasks. This paper introduces a KG-RAG (Knowledge Graph-Retrieval Augmented Generation) pipeline, a novel framework designed to enhance the knowledge capabilities of LMAs by integrating structured Knowledge Graphs (KGs) with the functionalities of LLMs, thereby significantly reducing the reliance on the latent knowledge of LLMs. The KG-RAG pipeline constructs a KG from unstructured text and then performs information retrieval over the newly created graph to perform KGQA (Knowledge Graph Question Answering). The retrieval methodology leverages a novel algorithm called Chain of Explorations (CoE) which benefits from LLMs reasoning to explore nodes and relationships within the KG sequentially. Preliminary experiments on the ComplexWebQuestions dataset demonstrate notable improvements in the reduction of hallucinated content and suggest a promising path toward developing intelligent systems adept at handling knowledge-intensive tasks.",https://www.semanticscholar.org/paper/26702869774950e03b10a3657bca0621aa0d8d07,arXiv.org,RAG
