paper_id,title,authors,year,citation_count,abstract,url,venue,keyword
659bf9ce7175e1ec266ff54359e2bd76e0b7ff31,Retrieval-Augmented Generation for Knowledge-Intensive NLP Tasks,"Patrick Lewis, Ethan Perez, Aleksandara Piktus, F. Petroni, Vladimir Karpukhin, Naman Goyal, Heinrich Kuttler, M. Lewis, Wen-tau Yih, Tim Rocktäschel, Sebastian Riedel, Douwe Kiela",2020,12859,"Large pre-trained language models have been shown to store factual knowledge in their parameters, and achieve state-of-the-art results when fine-tuned on downstream NLP tasks. However, their ability to access and precisely manipulate knowledge is still limited, and hence on knowledge-intensive tasks, their performance lags behind task-specific architectures. Additionally, providing provenance for their decisions and updating their world knowledge remain open research problems. Pre-trained models with a differentiable access mechanism to explicit non-parametric memory can overcome this issue, but have so far been only investigated for extractive downstream tasks. We explore a general-purpose fine-tuning recipe for retrieval-augmented generation (RAG) -- models which combine pre-trained parametric and non-parametric memory for language generation. We introduce RAG models where the parametric memory is a pre-trained seq2seq model and the non-parametric memory is a dense vector index of Wikipedia, accessed with a pre-trained neural retriever. We compare two RAG formulations, one which conditions on the same retrieved passages across the whole generated sequence, the other can use different passages per token. We fine-tune and evaluate our models on a wide range of knowledge-intensive NLP tasks and set the state-of-the-art on three open domain QA tasks, outperforming parametric seq2seq models and task-specific retrieve-and-extract architectures. For language generation tasks, we find that RAG models generate more specific, diverse and factual language than a state-of-the-art parametric-only seq2seq baseline.",https://www.semanticscholar.org/paper/659bf9ce7175e1ec266ff54359e2bd76e0b7ff31,Neural Information Processing Systems,retrieval augmented generation
46f9f7b8f88f72e12cbdb21e3311f995eb6e65c5,Retrieval-Augmented Generation for Large Language Models: A Survey,"Yunfan Gao, Yun Xiong, Xinyu Gao, Kangxiang Jia, Jin Pan, Yuxi Bi, Yi Dai, Jiawei Sun, Qianyu Guo, Meng Wang, Haofen Wang",2023,3146,"Large Language Models (LLMs) showcase impressive capabilities but encounter challenges like hallucination, outdated knowledge, and non-transparent, untraceable reasoning processes. Retrieval-Augmented Generation (RAG) has emerged as a promising solution by incorporating knowledge from external databases. This enhances the accuracy and credibility of the generation, particularly for knowledge-intensive tasks, and allows for continuous knowledge updates and integration of domain-specific information. RAG synergistically merges LLMs' intrinsic knowledge with the vast, dynamic repositories of external databases. This comprehensive review paper offers a detailed examination of the progression of RAG paradigms, encompassing the Naive RAG, the Advanced RAG, and the Modular RAG. It meticulously scrutinizes the tripartite foundation of RAG frameworks, which includes the retrieval, the generation and the augmentation techniques. The paper highlights the state-of-the-art technologies embedded in each of these critical components, providing a profound understanding of the advancements in RAG systems. Furthermore, this paper introduces up-to-date evaluation framework and benchmark. At the end, this article delineates the challenges currently faced and points out prospective avenues for research and development.",https://www.semanticscholar.org/paper/46f9f7b8f88f72e12cbdb21e3311f995eb6e65c5,arXiv.org,retrieval augmented generation
f5e9e5bbe22f0263be1f1ce88c66978a2b927772,RAGAs: Automated Evaluation of Retrieval Augmented Generation,"ES Shahul, J. James, Luis Espinosa Anke, S. Schockaert",2023,586,"We introduce RAGAs (Retrieval Augmented Generation Assessment), a framework for reference-free evaluation of Retrieval Augmented Generation (RAG) pipelines. RAGAs is available at [https://github.com/explodinggradients/ragas]. RAG systems are composed of a retrieval and an LLM based generation module. They provide LLMs with knowledge from a reference textual database, enabling them to act as a natural language layer between a user and textual databases, thus reducing the risk of hallucinations. Evaluating RAG architectures is challenging due to several dimensions to consider: the ability of the retrieval system to identify relevant and focused context passages, the ability of the LLM to exploit such passages faithfully, and the quality of the generation itself. With RAGAs, we introduce a suite of metrics that can evaluate these different dimensions without relying on ground truth human annotations. We posit that such a framework can contribute crucially to faster evaluation cycles of RAG architectures, which is especially important given the fast adoption of LLMs.",https://www.semanticscholar.org/paper/f5e9e5bbe22f0263be1f1ce88c66978a2b927772,Conference of the European Chapter of the Association for Computational Linguistics,retrieval augmented generation
ba7952e7c4fb891c36980ca19f94251257da6eb7,Agentic Retrieval-Augmented Generation: A Survey on Agentic RAG,"Aditi Singh, Abul Ehtesham, Saket Kumar, T. T. Khoei",2025,255,"Large Language Models (LLMs) have advanced artificial intelligence by enabling human-like text generation and natural language understanding. However, their reliance on static training data limits their ability to respond to dynamic, real-time queries, resulting in outdated or inaccurate outputs. Retrieval-Augmented Generation (RAG) has emerged as a solution, enhancing LLMs by integrating real-time data retrieval to provide contextually relevant and up-to-date responses. Despite its promise, traditional RAG systems are constrained by static workflows and lack the adaptability required for multi-step reasoning and complex task management. Agentic Retrieval-Augmented Generation (Agentic RAG) transcends these limitations by embedding autonomous AI agents into the RAG pipeline. These agents leverage agentic design patterns reflection, planning, tool use, and multi-agent collaboration to dynamically manage retrieval strategies, iteratively refine contextual understanding, and adapt workflows through operational structures ranging from sequential steps to adaptive collaboration. This integration enables Agentic RAG systems to deliver flexibility, scalability, and context-awareness across diverse applications. This paper presents an analytical survey of Agentic RAG systems. It traces the evolution of RAG paradigms, introduces a principled taxonomy of Agentic RAG architectures based on agent cardinality, control structure, autonomy, and knowledge representation, and provides a comparative analysis of design trade-offs across existing frameworks. The survey examines applications in healthcare, finance, education, and enterprise document processing, and distills practical lessons for system designers and practitioners. Finally, it identifies key open research challenges related to evaluation, coordination, memory management, efficiency, and governance, outlining directions for future research.",https://www.semanticscholar.org/paper/ba7952e7c4fb891c36980ca19f94251257da6eb7,arXiv.org,retrieval augmented generation
b798cf6af813638fab09a8af6ad0f3df6c241485,Benchmarking Retrieval-Augmented Generation for Medicine,"Guangzhi Xiong, Qiao Jin, Zhiyong Lu, Aidong Zhang",2024,468,"While large language models (LLMs) have achieved state-of-the-art performance on a wide range of medical question answering (QA) tasks, they still face challenges with hallucinations and outdated knowledge. Retrieval-augmented generation (RAG) is a promising solution and has been widely adopted. However, a RAG system can involve multiple flexible components, and there is a lack of best practices regarding the optimal RAG setting for various medical purposes. To systematically evaluate such systems, we propose the Medical Information Retrieval-Augmented Generation Evaluation (MIRAGE), a first-of-its-kind benchmark including 7,663 questions from five medical QA datasets. Using MIRAGE, we conducted large-scale experiments with over 1.8 trillion prompt tokens on 41 combinations of different corpora, retrievers, and backbone LLMs through the MedRAG toolkit introduced in this work. Overall, MedRAG improves the accuracy of six different LLMs by up to 18% over chain-of-thought prompting, elevating the performance of GPT-3.5 and Mixtral to GPT-4-level. Our results show that the combination of various medical corpora and retrievers achieves the best performance. In addition, we discovered a log-linear scaling property and the""lost-in-the-middle""effects in medical RAG. We believe our comprehensive evaluations can serve as practical guidelines for implementing RAG systems for medicine.",https://www.semanticscholar.org/paper/b798cf6af813638fab09a8af6ad0f3df6c241485,Annual Meeting of the Association for Computational Linguistics,retrieval augmented generation
da83852315c884c73dc527a4b7bc1209fbb037c3,MedRAG: Enhancing Retrieval-augmented Generation with Knowledge Graph-Elicited Reasoning for Healthcare Copilot,"Xuejiao Zhao, Siyan Liu, Su-Yin Yang, C. Miao",2025,127,"Retrieval-augmented generation (RAG) is a well-suited technique for retrieving privacy-sensitive Electronic Health Records (EHR). It can serve as a key module of the healthcare copilot, helping reduce misdiagnosis for healthcare practitioners and patients. However, the diagnostic accuracy and specificity of existing heuristic-based RAG models used in the medical domain are inadequate, particularly for diseases with similar manifestations. This paper proposes MedRAG, a RAG model enhanced by knowledge graph (KG)-elicited reasoning for the medical domain that retrieves diagnosis and treatment recommendations based on manifestations. MedRAG systematically constructs a comprehensive four-tier hierarchical diagnostic KG encompassing critical diagnostic differences of various diseases. These differences are dynamically integrated with similar EHRs retrieved from an EHR database, and reasoned within a large language model. This process enables more accurate and specific decision support, while also proactively providing follow-up questions to enhance personalized medical decision-making. MedRAG is evaluated on both a public dataset DDXPlus and a private chronic pain diagnostic dataset (CPDD) collected from Tan Tock Seng Hospital, and its performance is compared against various existing RAG methods. Experimental results show that, leveraging the information integration and relational abilities of the KG, our MedRAG provides more specific diagnostic insights and outperforms state-of-the-art models in reducing misdiagnosis rates. Our code will be available at https://github.com/SNOWTEAM2023/MedRAG",https://www.semanticscholar.org/paper/da83852315c884c73dc527a4b7bc1209fbb037c3,The Web Conference,retrieval augmented generation
f4e06256ab07727ff4e0465deea83fcf45012354,PoisonedRAG: Knowledge Corruption Attacks to Retrieval-Augmented Generation of Large Language Models,"Wei Zou, Runpeng Geng, Binghui Wang, Jinyuan Jia",2024,134,"Large language models (LLMs) have achieved remarkable success due to their exceptional generative capabilities. Despite their success, they also have inherent limitations such as a lack of up-to-date knowledge and hallucination. Retrieval-Augmented Generation (RAG) is a state-of-the-art technique to mitigate these limitations. The key idea of RAG is to ground the answer generation of an LLM on external knowledge retrieved from a knowledge database. Existing studies mainly focus on improving the accuracy or efficiency of RAG, leaving its security largely unexplored. We aim to bridge the gap in this work. We find that the knowledge database in a RAG system introduces a new and practical attack surface. Based on this attack surface, we propose PoisonedRAG, the first knowledge corruption attack to RAG, where an attacker could inject a few malicious texts into the knowledge database of a RAG system to induce an LLM to generate an attacker-chosen target answer for an attacker-chosen target question. We formulate knowledge corruption attacks as an optimization problem, whose solution is a set of malicious texts. Depending on the background knowledge (e.g., black-box and white-box settings) of an attacker on a RAG system, we propose two solutions to solve the optimization problem, respectively. Our results show PoisonedRAG could achieve a 90% attack success rate when injecting five malicious texts for each target question into a knowledge database with millions of texts. We also evaluate several defenses and our results show they are insufficient to defend against PoisonedRAG, highlighting the need for new defenses.",https://www.semanticscholar.org/paper/f4e06256ab07727ff4e0465deea83fcf45012354,USENIX Security Symposium,retrieval augmented generation
4e71624e90960cb003e311a0fe3b8be4c2863239,MultiHop-RAG: Benchmarking Retrieval-Augmented Generation for Multi-Hop Queries,"Yixuan Tang, Yi Yang",2024,242,"Retrieval-augmented generation (RAG) augments large language models (LLM) by retrieving relevant knowledge, showing promising potential in mitigating LLM hallucinations and enhancing response quality, thereby facilitating the great adoption of LLMs in practice. However, we find that existing RAG systems are inadequate in answering multi-hop queries, which require retrieving and reasoning over multiple pieces of supporting evidence. Furthermore, to our knowledge, no existing RAG benchmarking dataset focuses on multi-hop queries. In this paper, we develop a novel dataset, MultiHop-RAG, which consists of a knowledge base, a large collection of multi-hop queries, their ground-truth answers, and the associated supporting evidence. We detail the procedure of building the dataset, utilizing an English news article dataset as the underlying RAG knowledge base. We demonstrate the benchmarking utility of MultiHop-RAG in two experiments. The first experiment compares different embedding models for retrieving evidence for multi-hop queries. In the second experiment, we examine the capabilities of various state-of-the-art LLMs, including GPT-4, PaLM, and Llama2-70B, in reasoning and answering multi-hop queries given the evidence. Both experiments reveal that existing RAG methods perform unsatisfactorily in retrieving and answering multi-hop queries. We hope MultiHop-RAG will be a valuable resource for the community in developing effective RAG systems, thereby facilitating greater adoption of LLMs in practice. The MultiHop-RAG and implemented RAG system is publicly available at https://github.com/yixuantt/MultiHop-RAG/.",https://www.semanticscholar.org/paper/4e71624e90960cb003e311a0fe3b8be4c2863239,arXiv.org,retrieval augmented generation
1ea143c34b9bc359780f79ba4d68dee68bcc1129,LightRAG: Simple and Fast Retrieval-Augmented Generation,"Zirui Guo, Lianghao Xia, Yanhua Yu, Tu Ao, Chao Huang",2024,242,"Retrieval-Augmented Generation (RAG) systems enhance large language models (LLMs) by integrating external knowledge sources, enabling more accurate and contextually relevant responses tailored to user needs. However, existing RAG systems have significant limitations, including reliance on flat data representations and inadequate contextual awareness, which can lead to fragmented answers that fail to capture complex inter-dependencies. To address these challenges, we propose LightRAG, which incorporates graph structures into text indexing and retrieval processes. This innovative framework employs a dual-level retrieval system that enhances comprehensive information retrieval from both low-level and high-level knowledge discovery. Additionally, the integration of graph structures with vector representations facilitates efficient retrieval of related entities and their relationships, significantly improving response times while maintaining contextual relevance. This capability is further enhanced by an incremental update algorithm that ensures the timely integration of new data, allowing the system to remain effective and responsive in rapidly changing data environments. Extensive experimental validation demonstrates considerable improvements in retrieval accuracy and efficiency compared to existing approaches. We have made our LightRAG open-source and available at the link: https://github.com/HKUDS/LightRAG",https://www.semanticscholar.org/paper/1ea143c34b9bc359780f79ba4d68dee68bcc1129,Conference on Empirical Methods in Natural Language Processing,retrieval augmented generation
a41d4a3b005c8ec4f821e6ee96672d930ca9596c,G-Retriever: Retrieval-Augmented Generation for Textual Graph Understanding and Question Answering,"Xiaoxin He, Yijun Tian, Yifei Sun, N. Chawla, T. Laurent, Yann LeCun, Xavier Bresson, Bryan Hooi",2024,238,"Given a graph with textual attributes, we enable users to `chat with their graph': that is, to ask questions about the graph using a conversational interface. In response to a user's questions, our method provides textual replies and highlights the relevant parts of the graph. While existing works integrate large language models (LLMs) and graph neural networks (GNNs) in various ways, they mostly focus on either conventional graph tasks (such as node, edge, and graph classification), or on answering simple graph queries on small or synthetic graphs. In contrast, we develop a flexible question-answering framework targeting real-world textual graphs, applicable to multiple applications including scene graph understanding, common sense reasoning, and knowledge graph reasoning. Toward this goal, we first develop a Graph Question Answering (GraphQA) benchmark with data collected from different tasks. Then, we propose our G-Retriever method, introducing the first retrieval-augmented generation (RAG) approach for general textual graphs, which can be fine-tuned to enhance graph understanding via soft prompting. To resist hallucination and to allow for textual graphs that greatly exceed the LLM's context window size, G-Retriever performs RAG over a graph by formulating this task as a Prize-Collecting Steiner Tree optimization problem. Empirical evaluations show that our method outperforms baselines on textual graph tasks from multiple domains, scales well with larger graph sizes, and mitigates hallucination.~\footnote{Our codes and datasets are available at: \url{https://github.com/XiaoxinHe/G-Retriever}}",https://www.semanticscholar.org/paper/a41d4a3b005c8ec4f821e6ee96672d930ca9596c,Neural Information Processing Systems,retrieval augmented generation
908d45b0d2b88ba72ee501c368eb618d29d61ce0,A Survey of Graph Retrieval-Augmented Generation for Customized Large Language Models,"Qinggang Zhang, Shengyuan Chen, Yuan-Qi Bei, Zheng Yuan, Huachi Zhou, Zijin Hong, Junnan Dong, Hao Chen, Yi Chang, Xiao Huang",2025,95,"Large language models (LLMs) have demonstrated remarkable capabilities in a wide range of tasks, yet their application to specialized domains remains challenging due to the need for deep expertise. Retrieval-Augmented generation (RAG) has emerged as a promising solution to customize LLMs for professional fields by seamlessly integrating external knowledge bases, enabling real-time access to domain-specific expertise during inference. Despite its potential, traditional RAG systems, based on flat text retrieval, face three critical challenges: (i) complex query understanding in professional contexts, (ii) difficulties in knowledge integration across distributed sources, and (iii) system efficiency bottlenecks at scale. This survey presents a systematic analysis of Graph-based Retrieval-Augmented Generation (GraphRAG), a new paradigm that revolutionizes domain-specific LLM applications. GraphRAG addresses traditional RAG limitations through three key innovations: (i) graph-structured knowledge representation that explicitly captures entity relationships and domain hierarchies, (ii) efficient graph-based retrieval techniques that enable context-preserving knowledge retrieval with multihop reasoning ability, and (iii) structure-aware knowledge integration algorithms that leverage retrieved knowledge for accurate and logical coherent generation of LLMs. In this survey, we systematically analyze the technical foundations of GraphRAG and examine current implementations across various professional domains, identifying key technical challenges and promising research directions. All the related resources of GraphRAG, including research papers, open-source data, and projects, are collected for the community in https://github.com/DEEP-PolyU/Awesome-GraphRAG.",https://www.semanticscholar.org/paper/908d45b0d2b88ba72ee501c368eb618d29d61ce0,arXiv.org,retrieval augmented generation
5879575701b9b65b5cc56c00d9eebbfa219e0428,Retrieval augmented generation for large language models in healthcare: A systematic review,"L. M. Amugongo, Pietro Mascheroni, Steve Brooks, Stefan Doering, Jan Seidel",2025,111,"Large Language Models (LLMs) have demonstrated promising capabilities to solve complex tasks in critical sectors such as healthcare. However, LLMs are limited by their training data which is often outdated, the tendency to generate inaccurate (“hallucinated”) content and a lack of transparency in the content they generate. To address these limitations, retrieval augmented generation (RAG) grounds the responses of LLMs by exposing them to external knowledge sources. However, in the healthcare domain there is currently a lack of systematic understanding of which datasets, RAG methodologies and evaluation frameworks are available. This review aims to bridge this gap by assessing RAG-based approaches employed by LLMs in healthcare, focusing on the different steps of retrieval, augmentation and generation. Additionally, we identify the limitations, strengths and gaps in the existing literature. Our synthesis shows that 78.9% of studies used English datasets and 21.1% of the datasets are in Chinese. We find that a range of techniques are employed RAG-based LLMs in healthcare, including Naive RAG, Advanced RAG, and Modular RAG. Surprisingly, proprietary models such as GPT-3.5/4 are the most used for RAG applications in healthcare. We find that there is a lack of standardised evaluation frameworks for RAG-based applications. In addition, the majority of the studies do not assess or address ethical considerations related to RAG in healthcare. It is important to account for ethical challenges that are inherent when AI systems are implemented in the clinical setting. Lastly, we highlight the need for further research and development to ensure responsible and effective adoption of RAG in the medical domain.",https://www.semanticscholar.org/paper/5879575701b9b65b5cc56c00d9eebbfa219e0428,PLOS Digital Health,retrieval augmented generation
83939671534dc3d374c9bc4e3e03b5ec2c7ba301,"Improving large language model applications in biomedicine with retrieval-augmented generation: a systematic review, meta-analysis, and clinical development guidelines","Siru Liu, Allison B. McCoy, Adam Wright",2025,104,"Abstract Objective The objectives of this study are to synthesize findings from recent research of retrieval-augmented generation (RAG) and large language models (LLMs) in biomedicine and provide clinical development guidelines to improve effectiveness. Materials and Methods We conducted a systematic literature review and a meta-analysis. The report was created in adherence to the Preferred Reporting Items for Systematic Reviews and Meta-Analyses 2020 analysis. Searches were performed in 3 databases (PubMed, Embase, PsycINFO) using terms related to “retrieval augmented generation” and “large language model,” for articles published in 2023 and 2024. We selected studies that compared baseline LLM performance with RAG performance. We developed a random-effect meta-analysis model, using odds ratio as the effect size. Results Among 335 studies, 20 were included in this literature review. The pooled effect size was 1.35, with a 95% confidence interval of 1.19-1.53, indicating a statistically significant effect (P = .001). We reported clinical tasks, baseline LLMs, retrieval sources and strategies, as well as evaluation methods. Discussion Building on our literature review, we developed Guidelines for Unified Implementation and Development of Enhanced LLM Applications with RAG in Clinical Settings to inform clinical applications using RAG. Conclusion Overall, RAG implementation showed a 1.35 odds ratio increase in performance compared to baseline LLMs. Future research should focus on (1) system-level enhancement: the combination of RAG and agent, (2) knowledge-level enhancement: deep integration of knowledge into LLM, and (3) integration-level enhancement: integrating RAG systems within electronic health records.",https://www.semanticscholar.org/paper/83939671534dc3d374c9bc4e3e03b5ec2c7ba301,,retrieval augmented generation
